{
  "$schema": "https://yusuke-hayashi.com/.well-known/schemas/identity-history-v1.schema.json",
  "schemaVersion": 1,
  "subject": "https://yusuke-hayashi.com",
  "updatedAt": "2026-07-22",
  "previousVersionSha256": "e72446c8a848d14be539b8ad83731bdaae4fe8c38776164393ee561c630439ff",
  "events": [
    {
      "id": "2026-07-12/openpgp-key-rotation",
      "effectiveAt": "2026-07-12",
      "type": "key-rotation",
      "summary": "The RSA-4096 primary key was superseded by an offline Ed25519 certify-only primary key with machine-scoped subkeys.",
      "identifiers": {
        "previousOpenpgpFingerprint": "F1B6AE71751BAC79EE04BC5789C325D41DD3055B",
        "currentOpenpgpFingerprint": "B22B98ABB2D503307AB6A3160718EFA6506BB669"
      },
      "evidence": [
        "https://yusuke-hayashi.com/keys"
      ]
    },
    {
      "id": "2026-07-13/ethereum-identity-created",
      "effectiveAt": "2026-07-13",
      "type": "identifier-created",
      "summary": "A dedicated public Ethereum identity account was created separately from asset-storage accounts.",
      "identifiers": {
        "ethereumAddress": "0x1C049D25D368bFD50c74df68c919a12aDc48C079"
      },
      "evidence": [
        "https://yusuke-hayashi.com/identity"
      ]
    },
    {
      "id": "2026-07-14/openpgp-ethereum-cross-attestation",
      "effectiveAt": "2026-07-14",
      "type": "proof-published",
      "summary": "Bidirectional OpenPGP and EIP-191 signatures linking the OpenPGP key and Ethereum account were published.",
      "identifiers": {
        "openpgpFingerprint": "B22B98ABB2D503307AB6A3160718EFA6506BB669",
        "ethereumAddress": "0x1C049D25D368bFD50c74df68c919a12aDc48C079"
      },
      "evidence": [
        "https://yusuke-hayashi.com/proofs/statement.txt.asc",
        "https://yusuke-hayashi.com/proofs/eth-attestation.json"
      ]
    },
    {
      "id": "2026-07-14/domain-identities-linked",
      "effectiveAt": "2026-07-14",
      "type": "identifier-linked",
      "summary": "The personal domain was linked to Bluesky through DNS and to Nostr through NIP-05.",
      "identifiers": {
        "blueskyDid": "did:plc:vesjclqfso2eo4h2dhfj3vwo",
        "nostrNip05": "yusuke@yusuke-hayashi.com"
      },
      "evidence": [
        "https://yusuke-hayashi.com/.well-known/nostr.json"
      ]
    },
    {
      "id": "2026-07-14/verifier-release-1",
      "effectiveAt": "2026-07-14",
      "type": "proof-published",
      "summary": "Verifier release 1 added anti-rollback revisions, canonical third-party signing payloads, and availability-independent revocation.",
      "identifiers": {
        "releaseRevision": "1"
      },
      "evidence": [
        "https://yusuke-hayashi.com/.well-known/verify-identity.mjs"
      ]
    },
    {
      "id": "2026-07-17/humanity-witness-framework",
      "effectiveAt": "2026-07-17",
      "type": "proof-published",
      "summary": "Verifier release 2 added a time-bounded in-person humanity-witness claim with fresh subject challenge and independent issuer signature verification; no witness record was issued by this framework release.",
      "identifiers": {
        "releaseRevision": "2",
        "humanityWitnessRecords": "0"
      },
      "evidence": [
        "https://yusuke-hayashi.com/.well-known/attestations/policy.json",
        "https://yusuke-hayashi.com/.well-known/schemas/third-party-attestation-v1.schema.json",
        "https://yusuke-hayashi.com/.well-known/verify-identity.mjs"
      ]
    },
    {
      "id": "2026-07-17/verifier-release-3",
      "effectiveAt": "2026-07-17",
      "type": "proof-published",
      "summary": "Verifier release 3 separated HTTP transport and error responsibilities without changing trust rules; operator checks added independent monitoring and exact OpenTimestamps proof binding.",
      "identifiers": {
        "releaseRevision": "3"
      },
      "evidence": [
        "https://yusuke-hayashi.com/.well-known/verify-identity.mjs",
        "https://yusuke-hayashi.com/identity"
      ]
    },
    {
      "id": "2026-07-18/ens-name-registered",
      "effectiveAt": "2026-07-18",
      "type": "identifier-linked",
      "summary": "The yhay81.eth name was registered for one year with matching forward and reverse resolution and public GitHub, URL, and OpenPGP text records.",
      "identifiers": {
        "ensName": "yhay81.eth",
        "ethereumAddress": "0x1C049D25D368bFD50c74df68c919a12aDc48C079",
        "registrationExpiresAt": "2027-07-18T09:27:23.000Z",
        "releaseRevision": "4"
      },
      "evidence": [
        "https://etherscan.io/tx/0x9b35b5ea112fac9bdecddcac219b9ac92e33015b1ee210e7f2a9210e7c2caff4",
        "https://app.ens.domains/yhay81.eth"
      ]
    },
    {
      "id": "2026-07-20/ens-profile-and-contenthash-published",
      "effectiveAt": "2026-07-20",
      "type": "proof-published",
      "summary": "ENS contenthash now names an immutable IPFS identity capsule, with IPFS avatar and public X and LinkedIn profile records; the signed verifier monitors every value.",
      "identifiers": {
        "ensName": "yhay81.eth",
        "contentHash": "ipfs://bafybeia7ayng6ol5j2e7uzqub4httj6mqbx2jel7zflwhfn7gaslzetwmu",
        "avatar": "ipfs://bafybeia7ayng6ol5j2e7uzqub4httj6mqbx2jel7zflwhfn7gaslzetwmu/me.webp",
        "twitterHandle": "yhay81",
        "linkedinHandle": "yhay81",
        "releaseRevision": "5"
      },
      "evidence": [
        "https://etherscan.io/tx/0xa04628b362817c92a929fc10e1c18082371c7616b145417a75a38969fc0e4423",
        "https://ipfs.io/ipfs/bafybeia7ayng6ol5j2e7uzqub4httj6mqbx2jel7zflwhfn7gaslzetwmu/",
        "https://app.ens.domains/yhay81.eth"
      ]
    },
    {
      "id": "2026-07-22/sigstore-first-release-plane",
      "effectiveAt": "2026-07-22",
      "type": "proof-published",
      "summary": "Verifier release 6 added a Sigstore-first release plane: GitHub Actions attests the exact identity manifest, a deterministic identity archive, and the deployment archive with SLSA provenance; the existing OpenPGP manifest remains the compatibility root until the physical 2-of-3 ceremony.",
      "identifiers": {
        "releaseRevision": "6",
        "manifestSchema": "4-compatibility",
        "targetManifestSchema": "5",
        "releaseAuthority": "yhay81/profile/.github/workflows/cloudflare.yml@refs/heads/main"
      },
      "evidence": [
        "https://yusuke-hayashi.com/.well-known/identity.json",
        "https://yusuke-hayashi.com/.well-known/releases/identity-release-r6.tar.gz",
        "https://yusuke-hayashi.com/integrity"
      ]
    }
  ]
}
